{
  "save_schema_version": "0.1.0",
  "persist": {
    "position": true,
    "variables": { "scopes": ["global", "persistent"] },
    "visitedScenes": true,
    "playTime": true,
    "stage": true,
    "music": true
  },
  "persistentVariablesSeparate": true,
  "slots": { "count": 10, "autosave": true }
}
